{
  "schemaVersion": 1,
  "name": "Quill",
  "roomId": "operations",
  "role": "crew",
  "model": "anthropic/claude-sonnet-5.5",
  "approvalMode": "ask",
  "connectorGrants": ["notion"],
  "schedules": [
    {
      "id": "daily-briefing",
      "cron": "0 8 * * 1-5",
      "timezone": "UTC",
      "prompt": "Write today's project briefing from the project hub.",
      "catchUp": false,
      "enabled": false
    }
  ]
}
